"pos","368","4","Carool Legal, mais poderia ter pelo menos 3 chances de errar"
"pos","408","4","Muito bom, o único problema e que trava muito"
"neu","550","4","Divertido Ele eh bem divertido masss enjoa"
"neu","459","4","e fera so nao dou 5 * pq tem uma hora q repete td"
"pos","472","4","Muito bom Viciante: jogo sempre a caminho do trabalho."
"neu","20","4","bom um pouco confuso troca de idioma mas pegou ok ignorancia a minha tirando essas coisas d idioma  otimo jogo"
"neu","624","4","Mais ou menos O aplicativo e muito simples se não fosse o record o jogo conserteza seios ruim mais eu gostei da pro gasto"
"pos","438","4","Muito bom Jogo bem divertido. Pena que a versão free tenha poucos níveis."
"pos","49","4","Agora em português! O que já era sensacional agora ficou melhor! Nova interface e com suporte ao português, enfim ... Recomendado! Vale a pena comprar!"
"pos","583","4","Mtu bom Jogo excelente.... So esses ads que atrapalham... NaO vou dar 5 estrelas por isso"
"pos","446","4","Graficos otimos Bem legal no início.  Vamos ver como e o jogo mais para frente"
"neu","649","4","Vale apena Tem um baita grafico, mas nao gostei tanto assim da jogabilidade, da camera, mas vale 4 estrelas"
"neu","435","4","Evoluçao Pra ser 5* so faltor a evoluçao"
"pos","487","4","Bom Dava para botar mais pistas , mais e bom"
"pos","365","4","Pou O único jogo legal"
"pos","525","4","Sou gostoso!! O jogo é otimo baixe ja"
"pos","437","4","Muito bom! Divertido..."
"pos","426","4","Andrio Esse jogo e muito legal"
"pos","550","4","Ana Muito bom... Apenas um só uma solução por dia... Muito pouco... Mesmo assim é bacana..."
"neu","358","4","Bom ms.... O jogo vive travando desde o primeiro mundo... Mto bom o jogo, ms qeria q arrumassem isso."
"neu","393","4","Da pra passar um tempinho jogando mais nao eh nada de mais. ..."
"pos","51","4","Vale a pena! Jogo muito bom.. Pena não ter áudio em outras línguas. E tem alguns bugs de touch no galaxy s2."
"pos","357","4","Marcello carvalho Quase real adorei d + legal curtao ai"
"pos","611","4","Bom O jogo é ótimo, porém no meu aparelho Galaxys2 não funciona bem, fora isso o jogo é nota 10, jogo toda hora com a minha namorada."
"pos","441","4","Divertido Só não dou 5 estrelas porque tem musica que ele não termina , tirando isso ele é show"
"pos","499","4","Bom Um dos melhores jogos para android"
"pos","370","4","bom Eu recomendo"
"neu","487","4","Alexandre-aracati Ha  jogo demorado para entrar !"
"neu","669","4","Almerindo galaxy mini.ainda nao sei,esta baixando mas parece ser bom."
"neu","383","4","Podia ter mais opcoes, mas funciona e eh legal! Funcionou no meu Galaxy Nexus, mas podia ter mais opcoes e a imagem com o celular deitado fica muito distorcida."
"neu","482","4","Semi Exelente O jogo e mto bom ,o ruim  e n consigo salvar o jogo e n estou conseguindo atualizar poderia pf fazer c que de para salvar?"
"pos","555","4","Muito bom... Pena que nao gosto muito de simuladores de corrida, prefiro jogos como Asphalt 6, mas esse jogo é bom... E difícil, kkkkkkk! Recomendo..."
"pos","610","4","Muito bom. Jogo desde a época do dos. Faltou idade dos jogadores, aposentadoria."
"pos","574","4","bom é bom recomendo"
"pos","636","4","Muito bom e realista"
"pos","598","4","Muito bom Gostei !"
"pos","487","4","Bom O jogo e bom da pra passa o tempo"
"pos","406","4","Go Muito legal. Meu filho adorou."
"pos","393","4","Muito bom Um otimo aplicativo. Só ficou faltando realmente uns grafites pra dar um toque mas style."
"neu","357","4","Vamo vamo inter O jogo e tri massa!!!"
"pos","450","4","Gostei Não tem aquele lance de energia pra te impedir de fazer tudo. É leve, roda bem no Galaxy W. Ruim que não tem recompensa por subir de nível."
"pos","440","4","Legalzinho Poderia ser melhor, mas é bonzinho :)"
"neu","466","4","Bom vai fundo Go"
"neu","545","4","@ly torres Mto bom, mas o cara a cara eh melhor pra blefar kkkkk"
"pos","635","4","Bom, recomendo¡"
"pos","471","4","Ótimo jogo Jogo muito bom com ótimos gráficos e Bem divertido. Os controles poderiam ser melhores e pode levar um tempo para acostumar. Recomendo"
"neg","446","4","Ele trava Na hora da comida sempre trava,pq o balde ñ vai onde a bolinha manda,por isso e tbm pelo barulho da racao caindo q dei 4estrelas"
"pos","533","4","Muito bom Vale a pena! Add ae galera 744.287.063, podem contar comigo! Muito bom!"
"pos","24","4","Bom demais! Bom mesmo esse jogo.Só esquentou um pouco e travou no galaxy note.Dou 4 estrelas."
"pos","641","4","Bom Funcionou bem no galaxy ace."
"neu","497","5","rafael Estou baixando, tomare que mt bom!!  Tchau galera FUIIIII!"
"neu","450","5","Japah Parabens¡!poderiam ter mais maneiras de ganhar nozes ficaria perfeito"
"neu","400","5","To baixando vamos ver se é bom."
"pos","534","5","Viciante Jogo muito bom e viciante, roda muito bem S II"
"neu","496","5","Bufalo Só demora para baixar"
"pos","532","5","Fodástico! Melhor jogo tps shooter que joguei!  Meus 4 droids tem instalado"
"neu","413","5","Estou baixando Espero que seja bom"
"pos","354","5","Otimoo Pega super bem no Galaxy y !!!  Vale a pena baixar :)"
"pos","641","5","Excelente!! Ótimo passatempo!! Viciante!!! Recomendo!!"
"pos","649","5","Six guns O melhor jogo que ja jogei para as smart"
"pos","555","5","Otimo Muito bom o jogo..."
"neu","365","5",":) O nome da minha é Tilacina, quem quiser pode nos visitar :)"
"pos","351","5","O melhor Esse é o melhor jogo de corts muito bom mesmo pode baixa que vale a pena"
"pos","370","5","Muito bom Sem dúvida o melhor jogo gratuito para Android. É já um clássico. Esta versão Rio é a melhor da série Angry Birds"
"pos","400","5","Diversão garantida. Passa tempo pra toda família. Super divertido."
"pos","515","5","Legalzinho. 5 stars, qero prwmios Vvv"
"pos","699","5","Bem legal. Bons gráficos"
"pos","489","5","Muito bom Excelente jogo preciso de vizinhos face José Carlos"
"pos","516","5","Muito bom o jogo! Tranquilo no zte v860 :)"
"pos","471","5","Muito bom! Com ajuda do chainfire e de um overclock estou rodando ele com os graficos no high no morotola defy."
"pos","402","5","comentario muito bom essa porra"
"pos","428","5","Tf700 mto bom!!!! Segue o padrao desvie, bloqueie e ataque, mas com um mundo todo novo... gosto deste tipo de jogo, portanto eu recomendo!!!!"
"pos","391","5","Bianca Eu gostei muito frase jogo"
"pos","446","5","SG II Excelente jogo Da pra imaginar ...... muito bom jogo"
"pos","387","5","Otimo jogo . Jogar cm a maquina sempre ganho melhora o nivel aumenta o nivel da maquina na dama tambem"
"pos","617","5","bom Gosto muito de jogos de RPG, é claro desde que tenham uma ótima história, tá aprovado"
"pos","367","5","nota 10 Esse jogo e tudo de bom"
"pos","413","5","Exelente vou zera esse jogo"
"pos","408","5","Recomendo... Otimo... Muito bom mesmo!"
"pos","399","5","Muito 10! Tem muitos efeitos visuais e sons legais. No caminho para o trabalho não tem descontraçao melhor!"
"pos","28","5","Foda! Não possui jogadores e marcas reais, mas é muito divertido. Ótimos gráficos e jogabilidade."
"pos","352","5","maravilhoso Com certeza o melhor jogo que tenho.."
"pos","352","5","Excelente A franquia Angry Birds é incrível. Recomendo!"
"pos","472","5","Excelente Pratico rápido leve"
"pos","530","5","Foda!!"
"pos","472","5","Excelente Recomento vc nao vai ser arrempender"
"pos","413","5","Show Muito show esse jogo.. Uso e recomendo!!"
"pos","611","5","Agora em português Excelente e agora em português"
"pos","545","5","@alisson santos Esse jogo e muito bom principalmente o tempo mínimo pra vc apostar so assim ñ fica gente moscando. Estão todos de parabéns ."
"pos","452","5","Bom O melhor jogo de tiro para android"
"pos","624","5","E muito bom Eu fiquei bem animado quando jogo esse jogoguinho"
"pos","649","5","Motorola Atrix 4G Muito foda este jogo,um amigo me falou e eu baixei.. recomendado, graficos e jogabilidade excelentes!"
"pos","422","5","Legal. Muito bom"
"pos","351","5","mtt bom Eu jogo no tablet da minha prima agora to baixando no meeu"
"pos","378","5","Luck 5 estrelas funciono mt bem no meu android 2.3 motorola actions t375"
"pos","487","5","Moto Toop de maiss... Bom passa tempo"
"pos","406","5","Nicolinha 05 Este jogo e muito bom bjs.      ;-)"
"pos","441","5","Muito bom Espectáculo"
"neu","407","5","Eu to baixando quero ver se é bom um beijão para todas as gatinhas do market"
"neu","375","5","Eu guero presentia subway surfer nãio e prata nem e ouro"
"pos","522","5","Demais Legal gostei!!"
"neg","454","5","Muito ruin Nao baixem essa merda pessimo jogo ruim."
"pos","362","5","Minhas escolhas Bom esse jogo ate que e legal!"
"pos","467","5","Galaxy S II Lite Jogo muito legal e engraçado. Dá pra se divertir bastante jogando!"
"pos","689","5","Muito bom Excelente jogo, excelente jogabilidade no tablet samsung galaxy tab10.1"
"pos","479","5","Muito show, adorei, nota 10 !!!"
"neu","664","5","Subordinado XD Eu so to dando esssa avaliaçao por causa de certos jogos"
"pos","80","5","Bom Jogo de estratégia muito bom parabéns, recomendo"
"pos","355","5","Muito bom Legal...mais eu queria conseguir ganhar dinheiro e rp mais facil"
"pos","382","5",":D Muito bom de todos o melhor"
"pos","23","5","18 centavos! Show de bola.."
"pos","398","5","Ótimo Meio filho adorou"
"pos","440","5","Muito bom Viciante e legal"
"neu","358","5","Sem erros Ei gente voces estao enganados,EU pausei e nao aconteceu nada,so fico a tela de pausa so."
"pos","635","5","Exelente Adorei Bom jogo e Boa dificuldade"
"pos","649","5","Maravilhoso Jogo muito bom, com excelentes gráficos... Estou adorando e é free ;-)"
"pos","530","5","Recomendo Excelente... super viciante!"
"pos","386","5","Otimo Meu numero 9947-8816 vivo"
"pos","358","5","Muitoo boom Tooh instalando agr maas como eu jah tenho os outros jogos desse app, concerteza jah sei q eh otimo...! :-D"
"pos","382","5","Muito bom Já jogava no iPad. No galaxy note e ainda melhor. Show."
"pos","534","5","Demais Pena que tem que acertar horrores pra liberar novas playlists.  Mas é muito legal!"
"pos","382","5","Genesis gt 7200 Roda lizinho otimo jogo adorei!!!"
"pos","361","5","Galaxy fit Achei o jogo tão bom que tive que desinstalar outros aplicativos pra poder jogar. Vale a pena baixar!"
"pos","147","5","9mm Muito bom o jogo!"
"pos","375","5","Myjja de Castro Este jogo é muito fx podem baixar a vontad....."
"pos","388","5","muito legal o melhor jogo de sk8"
"pos","388","5","Legal Eu gostei dos comentarios e eu sempre julgo um jogo pelos comentarios entao a maioria é bom vou baixar mas eu tbm recomendo a vcs"
"neu","425","5","Ai essa eu ganho A gora sai da frente"
"pos","354","5","Massa Muito divertido! Bom para se destrair e da nojo nas criancas. Ze filho"
"pos","3","5","Diversão garantida!"
"neu","361","5","O.o Sem palavras"
"pos","574","5","Jes Muito bom"
"pos","442","5","Melhor game de todos os sistemas operacionais, e olhe que eu tenho IOS, windowns phone e android. Com certeza esse jogo e epico!|"
"pos","611","5","Galaxy Tab 7.0 Plus Ótimo app. Como faço para apagar pessoas com quem não quero jogar mais ?"
"pos","440","5","Muito legal, depois de pegar o jeito"
"pos","413","5","Muito bom. !!!"
"pos","361","5","Excelente De longe um dos melhores jogos de android que ja joguei, ainda mais sendo free! Eu pagaria por ele e ainda sairia muito satisfeito!"
"pos","649","5","Muito booom Otimo game vale a penasem uvida"
"pos","452","5","Daya Jogo mt irado...vale a pena baixar..bj"
"pos","10","5","Intenso! Galaxy Tab 10.1 Perfeito, graficos excelentes.  Uma pena a jogabilidade ficar um pouco complicada em alguns momento, mas vale a compra."
"pos","375","5","Fodsdtovo Fodastico"
"pos","361","5","MUITo bOM Nossa muito legal mais tem um problema ele trava no me galaxy y mais eu recomendo"
"pos","450","5","Maravilhoso Adorei esse jogo muito legal, agente acaba se prendendo a cada fase, em cada família que você vai terminando, muitas outras coisas interessante."
"pos","397","5","Pura muito.bom! Otimo jogo!"
"pos","499","5","Podia ter multiplayer Mas o jogo e showw de bola!!!tomare que tenha um"
"pos","386","5","Muito bom lol Bgcgvhh"
"pos","472","5","Simples e divertido. Excelente idéia, e um ótimo passatempo para os momentos de ócio. ;-) Parabéns!"
"pos","368","5","Luciano Muito bom."
"pos","545","5","Legal este jogo é o melhor dos  jogos de poker"
"pos","490","5","Bom Esse jogo e muito bom vale apena baixar"
"pos","534","5","Otimo App muito bom, vale a pena"
"pos","570","5","Otimo Muito bom! Recomendadisso!"
"pos","532","5","Bastante bom O jogo é bom"
"pos","351","5","Excelente Jogo muito viciante!"
"pos","687","5","Excelente Bons tempos. Me lembro quando eu tinha 8 anos já jogava esse Snake. É igual os tijolos de antigamente"
"pos","2","5","Melhor no gênero Ficou muito bom no S3"
"pos","375","5","tablet da samsung muuuuito bom, recomendo de mais."
"pos","602","5","Mui bueno E otimo recomendo"
"pos","490","5","Adorei É viciante! No Xoom roda super bem. Alguns sao dificeis mas vale muito a pena!"
"pos","446","5","Exelente Muito bom, simplesmente viciante."
"pos","354","5","Adorei Otimo"
"neu","690","5","Besteirol Super"
"pos","649","5","Demais Extremamente bom, como sempre game loft mandando muito bem"
"pos","399","5","Galaxy mini Eu gostei e muito bom tem um gráfico excelente o som e perfeito baixem não vão se arrepende"
"pos","413","5","Jogoo Muito fera gosteiii!!"
"pos","398","5","Amei..Amei Excelente jogo!!Fácil de jogar e rrealmente viciante,merece 5 estrelas!!"
"pos","635","5","Muito bom, recomendo!"
"neu","662","5","VAI TOMA NO CU vai toma no cu, jogo é loco, bando de otarios ficam xingando o bagulho ae, vai se fude, compra uma porra de um cel melhor!"
"pos","491","5","muito bom Gostei muito desse jogo, vou até compra o pago. O desenvolvedor merece."
"pos","413","5","Galaxy ace Baixem eu recomendo muito bom ele voces cao adorar o grafico quem fez o jogo parabems muitooooooooo boooooooooom"
"neu","441","5","Mais ou menos O jogo é legal e tal...mais e o demo ai quando começa ah fika legal o jogo akaba ai pede pra abaixar novamente e ai temque pagar o jogo!!!.."
"pos","641","5","Excelente Funciona perfeitamente no atrix."
"pos","381","5","Muito show E maneiro o aplicativo zoei d+ meu pai fiquei embreagem kkkk"
"neu","455","5","Lara castroo Nada nada nafsss"
"pos","490","5","Show de boleta Muitos jogos e não é pesado"
"pos","361","5","Muito viciante Esse jogo é sensacional contagia qualquer um recomendo... Muito bom"
"pos","457","5","Muito bom!!!!! O game me testou muito não é tão fácil Kkkkkkkkkk"
"pos","351","5","Muito bom Esse jogo é muito bom é o melhor jogo que eu ja baixei depois do angry birs"
"pos","370","5","excelente mais nao consigo baixar n gal.5 diz erro 498alguem sabe me dizer o pq maiis fora isso jogo nota mil"
"pos","508","5","Excelente!!! Os excelentes graficos combinados com a otima jogabilidade tornam o jogo um grande competidor de outros jogos como Temple Run"
"neu","362","5","Será que presta? Tô baixando ainda alguém me diz se presta...por favor..."
"pos","391","5","Bem divertido... Vale a pena ter, muito bom para a hora do rush, ou aquela espera no consultóriomédico."
"pos","393","5","Perfeito Vale a pena jogo muito bom..."
"neu","361","5","Cu doido"
"pos","359","5","Muito bom Completei os niveis todos, exelentte"
"pos","583","5","Otimo Incrivel o jogo"
"neu","537","5","Tentando baixar"
"pos","2","5","Excelente Jogabilidade alucinante porém, embora bonitos ainda soam como gráficos de PS1.  A Gameloft precisa atualizar sua engine para fazer melhor uso dos recursos que ja temos hoje. No mais, otimo jogo."
"pos","392","5","Seba Muito bom"
"pos","358","5","Eduardo Adorei o jogo muito legal baixei gostei não  me  desepsionei vale 5 estrelas"
"pos","375","5","Lol Otimo pegou certinho no meu galaxy"
"pos","382","5","Viciante Roda tranquilo no SGS2, é atualmente o jogo mais legal pra passar o tempo."
"pos","437","5","Show! Recomendo."
"pos","561","5","Raryssa Muito legal e fofo!"
"pos","522","5","nicolas.keyth1@gmail Muito bom esse jogo"
"pos","450","5","Dimais Jogo dimais, bastante divertido.. Nota 10."
"neu","700","5","Bom Tem q marca 5 estrela pra jogar"
"neu","685","5","Parece legal, pena que não tem a resolução pro x10 mini pro"
"pos","490","5","Bom Os jogos sao simples mas viciantes"
"pos","407","5","otimo muito legau,rodou d boa no meu galaxy y,nota 10,podem baixar,incrivel"
"pos","88","5","Muito Bom Meu primeiro FF! #ShutUpAndTakeMyMoney"
"pos","351","5","Viciante Não consigo mais ir ao banheiro sem esse jogo!"
"pos","490","5","Excelente Bem legal o jogo"
"pos","365","5","meu filho amei. ele já é um filho pra mim :)"
"pos","534","5",". Não recomendo, POIS VOCÊ VAI VICIAR XD, muito bom, recomendo sim."
"pos","491","5",":) Recomendo a todos.."
"pos","456","5","Excelente Muito bom e extremamente viciante!! Comecem a jogar e usem o código vxp49656 logo após o tutorial, assim já vai adiantar o início com cartas mais fortes!!"
"neu","355","5","Level 7 Com qual carro passo do level 7? os desenvolvedores tiraram o aston martin one 77 agora ta muito dificil passar do level 7 Me ajudem pf."
"pos","452","5","Otimo jogo Otimo jogo recomendo"
"pos","361","5",". Esse jogo é o máximo!"
"pos","466","5","Excelente Vireeei , excelente o jogo ! Parabéns aos criadores (:"
"pos","360","5","Muito divertido amei"
"pos","649","5","Muito bom, excelente gráficos e rodou muito bem no galaxy s g70 roda melhor no iphone"
"pos","358","5","Perfeito Sem contras a nao ser do bug que ele se fecha no pause"
"pos","367","5","Muito bom. Muito bom mesmo passo hpras jogando."
"pos","537","5","Grande jogo Este é um dos melhores jogos da Play Store. Recomendo."
"neu","460","5","De todos do android Em se falando de jogos, so perde p 2"
"pos","573","5","Legal! Jogo da pra tira uma pira aos gráficos sao bem legais e não trava! Bem legal...Samsung galaxy 5"
"pos","534","5","Muito bom Extremamente viciante!"
"pos","452","5","Recomendo Nao tenho do que reclama muito bom esse jogo  recomendooooooooooo"
"pos","471","5","Diversão Joguinho bem divertido!"
"neu","441","5","Fabricio Num sei iskissi da hora brou"
"pos","490","5","Otimo Esse jogo é otimo  Recomendo"
"pos","413","5","Eraldo Perfeito no galaxy tab e roda legal no galaxy 5"
"pos","1","5","Incrível!!! Esse jogo é incrível, recomendo fortemente."
"pos","442","5","Tablet gt 7200 Muito bom recomendo so deveria ter mas brasileiro jogando mas mesmo assim é otimo"
"pos","619","5","Bobinho, mais divertido. Já deixei o meu morrer umas 5 vezes rs."
"pos","406","5","Da hora melhor do que skate boy Lança o bmx boy 2 tambem"
"neu","536","5","35 gente como e a 35"
"pos","361","5","Bom d+ Gostei muito"
"pos","489","5","Ótimo!! Amei... o jogo é ótimo,excelente... roda super bem *-*"
"pos","662","5","Bom demaiis.."
"neu","366","5","Kkkkkkkkkkkkk\" Minha mae comprou otro pra mim d verdade pensando q quebro agora tenho 2 galaxi y"
"pos","393","5","Nossa muito legal eu gosteeeeeeeeeeeeeei pode baixar muito bom"
"pos","440","5","Maravilha Super ótimo super viciante e muito legal"
"pos","400","5","Demais Mto bom. Só q é mto grande p um jogo. Mas é mto bom. Fico hrs jogando ! Parabens !"
"neg","700","5","Porcaria, tem que dar 5 estrelas por obrigação!"
"pos","571","5","Tab p7500 10.1 Muitooooo boooom, pega perfeitamente!"
"pos","690","5","Show Meu filho adora, muito Bom jogo!"
"pos","531","5","muito bom jogo bastante viciante. adicionem-me 236 653 260 obrigado."
"neg","352","5","Bah Esperava mais deste jogo tao falado. ..."
"pos","490","5","Adorei Muiro bom"
"pos","446","5","Legal Cinco estrelas, gráficos maneiros e muito bem elaborado o jogo"
"pos","352","5","Ana sofia No meu android foi 5* nao travou foi rapido a instalar... e o jogo em ci e maravilhoso ameeeei"
"pos","583","5","Muito bom Gostei muito!"
"pos","550","5","Bom demais o joguinho é de viciar qqr um!!!!"
"pos","550","5","Bom jogo, e ainda tem inf em portugues"
"neu","407","5","D£§§@ Recomendo,Afinal quem ñ resiste a uma partida ou duas de sonic ? Cai entre nois"
"pos","408","5","Muito legal Desenvolve bem"
"pos","352","5","Muito bom Sem duvidas muito bom deveria ser ate pago"
"pos","550","5","Bubble blast 2 Muito legal para passar o tempo, parabens aos desenvolvedores."
"pos","20","5","(: Perfeito no RAZR"
"pos","370","5","Show Muito bom esse joguinho. Vale pena baixar"
"pos","361","5","Genial Muuuuito bom!! Vale a pena baixar!!!"
"pos","649","5","Jogo bem legal. Quem jogou red dead e gostou tem que ter esse jogo no cel ou no tablet."
"pos","677","5","Incrível! Muito bom, acabei com a bateria do celular na primeira vez que peguei pra jogar! Os controles respondem muito bem, consegui os carro são completamente diferentes de pilotar. Muito legal!! Parabéns Remedy por trazer o Death Rally pro Android!!!"
"pos","425","5","Uno Adoro"
"pos","635","5","O melhor O melhor que existe aqui. E principalmente por ser grátis e com qualidade."
"pos","452","5","Excelente Eu recomendo"
"pos","352","5","Angry birds Eu amo esse jogo"
"pos","6","5","Galaxy S3 Ficou perfeito no meu GS3 ."
"pos","471","5","S2s2samuel2s2s2 O melhor jogo de zumbi q eu já vai na minha vida para Android roda 100% no meu s2"
"pos","534","5","Top Jogo muito bom, gostei muito"
"pos","534","5","Viciante Muito bom e viciante!"
"pos","413","5","Muito bom É mais legal porq d pra jogar online"
"pos","520","5","Galaxy 551 Éhh bom! Pode baixar que não tem erro!"
"pos","366","5","É muito legal meu irmão tinha no celular agora vou botar no meu"
"pos","650","5","Amei Adorei viciante d+ quem baixar vai adorar"
"pos","532","5","Muito divertido Vale apena grafico bom e divertido"
"pos","487","5","Muito loco Bom de maissssssssssss"
"pos","452","5","Galaxy s3 Excelente. Igualzinho ao pc, com bots e tudo."
"pos","635","5","O melhor do gênero até agora!"
"pos","546","5","Viciante!!! Add eu ae aliança code: 9MBKPA. Jogo mt bom pra passar o tempo. e td online."
"pos","487","5","Mto legal ! Soh o som da moto q irrita depois de algum tempo !mais eh mt legal !"
"pos","351","5","Maravilhoso Eu baixei no meu tablet e adorei vcs tbm te q baixar!!!!"
"pos","574","5","Muito bom Perfeito para pensar um pouco"
"neu","2","5","Licença Inválida Comprei o jogo e baixei 3 vezes, quando finaliza, diz que a licença é inválida. Não sei mais o que fazer."
"neu","400","5","Angry bird Eu gostei muito de todos os angry bird mas eu nunca jogei o space mas estou e nstalando agora"
"pos","695","5","Muito bom no s2"
"pos","457","5","Otimo Melhor jogo. Recomendo"
"pos","532","5","Mau Mtoo bom!!! Passo hras jogando!!!"
"pos","499","5","Matheus Nobre Muito bom o jogo só e chato o lance da energia mas o resto ta de parabéns!"
"pos","36","5","Excelente Muito bom, graficos perfeitos"
"pos","550","5","Viciante Incrivel Muito bom e viciante demais, vale a pena."
"pos","602","5","Xperia U Recomendo!"
"neu","3","5","O jogo não baixa"
"pos","413","5","Anderson,é um jogo ecelente o melhor jogo de celular que eu já joguei pelomenos no meu galaxy 3 é incrivel"
"pos","408","5","Jogo bom Baixei o jogo a diversão é garantida, a única coisa é que entre o intermediário e o difícil deveria ter mais um nível. No médio ganho todas no difícil só se perde. Bacana valeu."
"pos","91","5","Otimo! Nao sou muito de comentar sobre os jogos ,mas esse realmente merece ! Melhor jogo que ja baixei,quem jogar isso vai se emprecionar"
"pos","489","5","ótimoo Recomendado :-)"
"neu","452","5","Show E ruim nao deixa eu entrar online   tambem so deixa entrar off mais ainda so por um 15 minutos mais so comigo entao baixem ae"
"pos","490","5","Legal No meu galaxy pegou mto bem...achei bem legal..."
"pos","413","5","Excelentes gráficos. Excelente som. Razoável jogabilidade. Até agora o melhor simulador pra android."
"pos","354","5","Amei Muito bom o jogo!!!!!!"
"pos","361","5","Galaxy  Y Mtmtmt boom  .....estou quase viciada nele"
"pos","466","5","Excelente! Ótimo jogo.. Ele te prende ateh virar.. To quase virando o meu.."
"pos","555","5","Sensacional.... Adorei. Grafico perfeito."
"pos","515","5","Muito bom! Adorei o jogo! ótimo de jogar."
"pos","602","5","Muinto bom Esse jogo e muinto legal .nota 10"
"pos","523","5","Louco Muito legal fora a parte que eu sou ruim"
"pos","33","5","Muito bom Simples e divertido"
"pos","381","5","Daoraaa d mais No meu funcionou perfeitamente"
"pos","641","5","Simples,mas extremamente bom e divertido. Graficos regulares. Som fraco.desafio otimo. Replay infinito."
"pos","400","5","Ameii...yara Yara....Muito massa mesmo ! Tou viciada...e recomendo! Podem baixar, vc nao vaai se arrepender!"
"pos","487","5","Bom Esse jogo en mto foda Gostei mto"
"pos","382","5","Defy mini xt321 Muito bom mesmo vale a pena gastar seu tempo com ele meus parabens,5 estrelas !!"
"pos","490","5","Muito bom Grande coletânea ,vários bons desafios."
"pos","545","5","Otimo Muito bom, o melhor de todos.."
"pos","358","5","Dani Todos os jogos da rovio sao bons."
"pos","399","5","Otimo jogo excelente mas no xt300 roda devagar."
"pos","452","5","Excelente Muito bom,quase nenhum bug e tem varios mapas.Nao é enjoativo"
"pos","460","5","Otimo Muito bom recomendo grafico e bom e a direçao tambem podem baixar"
"pos","522","5","Eu ja baixei umas 3000mil vesis i costei e muito bom eu amo esi jogo :)"
"pos","408","5","Ótimo Muito bom mesmo."
"pos","611","5",". Muito bom.. Adoro  jogar"
"pos","471","5","Ótimo Gráficos excelentes, é a prova de quanto os jogos móveis evoluíram.  Muito bom. Roda perfeito no Galaxy Nexus"
"pos","515","5","Legal Top de mais"
"pos","532","5","Sony Xperia arc s Muito bom, melhor"
